Place,City,Overall,,Food,Value for Money,Service,Ambiance,Vegan Options,Category,Cuisine,Note
Cha Ya,San Francisco,6.42,,6.2,5,8,6,10,Food,Asian,Tempura was really good but the soba noodles and the broth were alright. I'd come here again if I was in the area I guess lol
Kasa Indian,San Francisco,6.35,,6.5,5,5,5,5,Food,Indian,Decent indian food but still mid overall :(
Ponko's Chicken,Atlanta,6.28,,6.5,4,5,5,4,Food,American,
Beyond Sushi,New York,6.28,,6,7,8,7,10,Food,Sushi,App wasnt that good honestly but the sushi was above average
HJ Farm Mart,Atlanta,6.27,,6,8,8,6,10,Food,Korean,I need to get the steak but the bowl thing i had was alright
Planta,Chicago,6.26,,6,3,6,9,10,Food,American,
Study Social,San Francisco,6.21,,6,6,7,5,10,Drink,Cafe,The vibes were great if you were'nt trying to get anything done smh. Coffee is aight. FInd better places
The Creamy Spot,Atlanta,6.21,,6,7,8,4,10,Dessert,Ice Cream,Overhyped icecream
Vietvana,Atlanta,6.19,,6,5,6,5,10,Food,Pho,
Burlap Coffee,Oakland,6.19,,6,5,6,5,10,Drink,Cafe,No comments. Okay coffee
Souvlaki,San Francisco,6.19,,6.5,6,5,5,2,Food,Mediterranean,"Pita sandwhich was alright, would go here again in a pinch but not out of my way fs"
CyBelle's Front Room,San Francisco,6.19,,6,3,6,6,10,Food,American,None of the savories are reallyyyyyy good. They're mid. Its like they're stuck in the 2000's with their vegan subs. Like get an upgrade pls.
Hippie Hibachi,Atlanta,6.18,,6,5,5,5,10,Food,American,little above mid food
Plant Based Pizzeria,Atlanta,6.15,,6,4,7,3,10,Food,Pizza,
Curry Up Now,Atlanta,6.10,,6.5,5,5,4,1,Food,Indian,Food is aight
Eat Americana,San Francisco,6.10,,6.5,6,4,4,1,Food,American,Alright Restaurant in the middle of an alright neighborhood. Alright/10
Creperie Cafe,Monterey,6.03,,6.2,5,4,6,4,Food,Breakfast,Lots of crepes. The were filling and decent but nothing great haha.
E Ramen,Atlanta,5.99,,6,6,8,7,5,Food,Japanese,
Kaiyo,San Francisco,5.98,,6,3,8,8,5,Food,Japanese,Kinda mids for the vibes of the place. Its definetly meant to be a fancy place given the portion sizes and the price but the wrap thing i got and the appetiezer were so bad lol
Spice of America,San Francisco,5.97,,6,5,4,6,6,Food,Indian,"Keeps up the trend of shitty SF indian restaurants. It was WILD, there was nobody inside, i had to go to the back to get someones attention - food took 40 minutes to come out just to be incredibly mid"
Food Terminal,Atlanta,5.96,,6,9,4,6,5,Food,Asian,Tofu was weeeeak the noodles were pretty good
Chai Pani,Atlanta,5.96,,6,4,4,6,6,Food,Indian,Overhyped. I hear the sit down order menu is good but the buffet I experienced was mid
Little Rey's,Atlanta,5.94,,6,7,7,5,5,Food,Taco,Two Vegan tacos and they're pretty good. Go to velvet instead
Bartaco,Atlanta,5.89,,6,4,5,5,5,Food,American,
Cafe Lucia,Atlanta,5.78,,5.5,5,7,6,10,Drink,Cafe,Most of their flavors are pretty mid tbh
Emerald City Bagels,Atlanta,5.62,,6,3,2,5,1,Food,Bagel,Very unhappy with the size of the bagel and the taste of the cream cheese as well
R Thomas Deluxe Grille,Atlanta,5.48,,5.5,3,5,5,6,Food,American,Mid Food exorbitant pricing :\
Ahn's Kitchen,Atlanta,5.27,,5,6,3,5,10,Food,Vietnamese,
Tuk Tuk,Atlanta,5.25,,5,3,4,5,10,Food,Thai,
Snooze,Atlanta,5.18,,5,6,6,7,7,Food,Brunch,Pretty terrible food. Unspiced
Vegan vs Fries,Atlanta,5.17,,5,4,4,1,10,Food,American,Food truck that served mid food at mid quality
Asian Vegan Kitchen,Atlanta,5.15,,5,3,3,1,10,Food,Asian,Middiest Mid food I've ever had. Huge portions though
Silverlake Ramen,Atlanta,5.00,,5,4,6,5,5,Food,Japanese,Mid ramen unless you dump 100 gallons of sriracha in the broth
Estrella Taqueria,San Francisco,4.98,,5,8,8,1,5,Food,Mexican,Not really a great burrito but its food and a very low price point. The tofu was soggy and not delectible but its alright. They tossed in some free chips as well. Those were solid
Sankranti,Atlanta,4.81,,5,6,6,3,2,Food,Indian,"Indian chipotle. the samosa is good, the rest is mid"
Takorea Del Sol,Atlanta,4.37,,4,5,4,5,10,Food,Mexican,
E & O Kitchen and Bar,San Francisco,4.37,,4.5,2,8,7,1,Food,American,Small portion exorbitant prices and some of worst food i've had at this price point
Bakaris Plant Pizza,Atlanta,4.36,,4,2,8,4,10,Food,Pizza,"Terrible pizza, don't go here anymore"
So Kong Dong,Atlanta,4.10,,4,5,3,6,5,Food,Korean,Tofu soup place. Kinda average taste
Shoya,Atlanta,4.09,,4,5,4,5,5,Food,Japanese,I went when i was sick but they gave me hot water. The food was meh
Which Which,Atlanta,3.52,,3,9,8,3,10,Food,American,
Taco Bell,Atlanta,3.47,,3,9,8,1,10,Food,Taco,
Citrus Club,San Francisco,3.11,,3,3,3,3,5,Food,Thai,"Mega ass, the creamy flavor in my dish was kinda sour. I literally couldn't finish it. don't go back lol"
Urban Wings,Atlanta,2.93,,3,2,6,4,1,Food,Wings,I hated these. Got the nashville hot flavor which i realized wasn't vegan until it was too late. I wonder if that affected the taste
White Noise,New York,2.58,,2,2,8,5,10,Drink,Cafe,poopoo coffee
Envegan,Atlanta,2.55,,2,5,6,3,10,Food,American,Highkey terrible food lol
Grass VBQ,Atlanta,2.52,,2,3,5,3,10,Food,Burger,Mouth would be drenched in oil after a bite
Potions,Hawaii,1.00,,1,1,1,1,1,Food,"""Indian""",let the ratings speak for itself